{
  "schemaVersion": "1.0.0",
  "designId": "7c1e4b20-9a3d-4f5e-8b6c-1d2e3f4a5b6c",
  "briefId": "3f2a9c41-7b2e-4d1a-9f3c-0a1b2c3d4e5f",
  "briefRevision": 1,
  "version": 1,
  "kind": "line_art",
  "status": "accepted",
  "createdAt": "2026-09-19T11:00:00Z",
  "image": {
    "storageKey": "designs/7c1e4b20/v1.png",
    "mediaType": "image/webp",
    "widthPx": 1024,
    "heightPx": 2048,
    "byteSize": 482113
  },
  "provenance": {
    "provider": "fixture",
    "model": "fixture-deterministic-v1",
    "prompt": "American traditional snake and dagger, bold linework, flat artwork on transparent background",
    "seed": 12345
  }
}
